[
	{
		"alias": 0,
		"position": 0,
		"vendor_id": "0x00000002",
		"product_code": "0x044c2c52"
	},

	{
		"alias": 0,
		"position": 1,
		"vendor_id": "0x00000002",
		"product_code": "0x0fa43052",

		"syncs": [
			{
				"index": 2,
				"watchdog_enabled": false,
				"pdos": [
					{
						"index": "0x1600",
						"entries": [
							{
								"index": "0x7000",
								"subindex": "0x01",
								"size": 16,

								"add_to_domain": true,
								"swap_endian": false,
								"signed": true
							}
						]
					},

					{
						"index": "0x1601",
						"entries": [
							{
								"index": "0x7010",
								"subindex": "0x01",
								"size": 16,

								"add_to_domain": true,
								"swap_endian": false,
								"signed": true
							}
						]
					},

					{
						"index": "0x1602",
						"entries": [
							{
								"index": "0x7020",
								"subindex": "0x01",
								"size": 16,

								"add_to_domain": true,
								"swap_endian": false,
								"signed": true
							}
						]
					},

					{
						"index": "0x1603",
						"entries": [
							{
								"index": "0x7030",
								"subindex": "0x01",
								"size": 16,

								"add_to_domain": true,
								"swap_endian": false,
								"signed": true
							}
						]
					}
				]
			}
		]
	},

	{
		"alias": 0,
		"position": 2,
		"vendor_id": "0x00000002",
		"product_code": "0x18503052",

		"syncs": [
			{
				"index": 2,
				"watchdog_enabled": false,
				"pdos": [
					{
						"index": "0x1600"
					},
					{
						"index": "0x1601"
					},
					{
						"index": "0x1602"
					},
					{
						"index": "0x1603"
					}
				]
			},

			{
				"index": 3,
				"watchdog_enabled": false,
				"pdos": [
					{
						"index": "0x1a00",
						"entries": [
							{
								"index": "0x6000",
								"subindex": "0x01",
								"size": 16,

								"add_to_domain": true,
								"swap_endian": true,
								"signed": false
							}
						]
					},

					{
						"index": "0x1a80",
						"entries": [
							{
								"index": "0xf100",
								"subindex": "0x01",
								"size": 8,

								"add_to_domain": true,
								"swap_endian": false,
								"signed": false
							},

							{
								"index": "0xf100",
								"subindex": "0x02",
								"size": 8,

								"add_to_domain": false,
								"swap_endian": false,
								"signed": false
							},

							{
								"index": "0xf100",
								"subindex": "0x03",
								"size": 8,

								"add_to_domain": false,
								"swap_endian": false,
								"signed": false
							},

							{
								"index": "0xf100",
								"subindex": "0x04",
								"size": 8,

								"add_to_domain": false,
								"swap_endian": false,
								"signed": false
							}

						]
					},

					{
						"index": "0x1a81",
						"entries": [
							{
								"index": "0x0000",
								"subindex": "0x00",
								"size": 12,

								"add_to_domain": false,
								"swap_endian": false,
								"signed": false
							},

							{
								"index": "0xf101",
								"subindex": "0x0d",
								"size": 1,

								"add_to_domain": true,
								"swap_endian": false,
								"signed": false
							},

							{
								"index": "0x0000",
								"subindex": "0x00",
								"size": 2,

								"add_to_domain": false,
								"swap_endian": false,
								"signed": false
							},

							{
								"index": "0xf101",
								"subindex": "0x10",
								"size": 1,

								"add_to_domain": true,
								"swap_endian": false,
								"signed": false
							}
						]
					}
				]
			}
		],

		"parameters": [
			{
				"index": "0x8000",
				"subindex": "0x04",
				"size": 32,
				"value": "0x55"
			},
			{
				"index": "0x8000",
				"subindex": "0x05",
				"size": 32,
				"value": "0x014d"
			},
			{
				"index": "0x8000",
				"subindex": "0x20",
				"size": 8,
				"value": "0x11"
			},
			{
				"index": "0x8000",
				"subindex": "0x21",
				"size": 8,
				"value": "0x2b"
			},
			{
				"index": "0x8000",
				"subindex": "0x24",
				"size": 8,
				"value": "0xc3"
			},
			{
				"index": "0x8000",
				"subindex": "0x28",
				"size": 16,
				"value": "0x23"
			}
		]
	},

	{
		"alias": 0,
		"position": 3,
		"vendor_id": "0x00000002",
		"product_code": "0x0c663052",

		"syncs": [
			{
				"index": 3,
				"watchdog_enabled": false,
				"pdos": [
					{
						"index": "0x1a00",
						"entries": [
							{
								"index": "0x6000",
								"subindex": "0x01",
								"size": 1
							},

							{
								"index": "0x6000",
								"subindex": "0x02",
								"size": 1
							},

							{
								"index": "0x6000",
								"subindex": "0x03",
								"size": 2
							},

							{
								"index": "0x6000",
								"subindex": "0x05",
								"size": 2
							},

							{
								"index": "0x6000",
								"subindex": "0x07",
								"size": 1
							},

							{
								"index": "0x0000",
								"subindex": "0x00",
								"size": 1
							},

							{
								"index": "0x0000",
								"subindex": "0x00",
								"size": 5
							},

							{
								"index": "0x6000",
								"subindex": "0x0e",
								"size": 1
							},

							{
								"index": "0x6000",
								"subindex": "0x0f",
								"size": 1
							},

							{
								"index": "0x6000",
								"subindex": "0x10",
								"size": 1
							},

							{
								"index": "0x6000",
								"subindex": "0x11",
								"size": 16,

								"add_to_domain": true,
								"signed": false
							}
						]
					},

					{
						"index": "0x1a02",
						"entries": [
							{
								"index": "0x6010",
								"subindex": "0x01",
								"size": 1
							},

							{
								"index": "0x6010",
								"subindex": "0x02",
								"size": 1
							},

							{
								"index": "0x6010",
								"subindex": "0x03",
								"size": 2
							},

							{
								"index": "0x6010",
								"subindex": "0x05",
								"size": 2
							},

							{
								"index": "0x6010",
								"subindex": "0x07",
								"size": 1
							},

							{
								"index": "0x0000",
								"subindex": "0x00",
								"size": 1
							},

							{
								"index": "0x0000",
								"subindex": "0x00",
								"size": 5
							},

							{
								"index": "0x6010",
								"subindex": "0x0e",
								"size": 1
							},

							{
								"index": "0x6010",
								"subindex": "0x0f",
								"size": 1
							},

							{
								"index": "0x6010",
								"subindex": "0x10",
								"size": 1
							},

							{
								"index": "0x6010",
								"subindex": "0x11",
								"size": 16,

								"add_to_domain": true,
								"signed": false
							}
						]
					},

					{
						"index": "0x1a04",
						"entries": [
							{
								"index": "0x6020",
								"subindex": "0x01",
								"size": 1
							},

							{
								"index": "0x6020",
								"subindex": "0x02",
								"size": 1
							},

							{
								"index": "0x6020",
								"subindex": "0x03",
								"size": 2
							},

							{
								"index": "0x6020",
								"subindex": "0x05",
								"size": 2
							},

							{
								"index": "0x6020",
								"subindex": "0x07",
								"size": 1
							},

							{
								"index": "0x0000",
								"subindex": "0x00",
								"size": 1
							},

							{
								"index": "0x0000",
								"subindex": "0x00",
								"size": 5
							},

							{
								"index": "0x6020",
								"subindex": "0x0e",
								"size": 1
							},

							{
								"index": "0x6020",
								"subindex": "0x0f",
								"size": 1
							},

							{
								"index": "0x6020",
								"subindex": "0x10",
								"size": 1
							},

							{
								"index": "0x6020",
								"subindex": "0x11",
								"size": 16,

								"add_to_domain": true,
								"signed": false
							}
						]
					},

					{
						"index": "0x1a06",
						"entries": [
							{
								"index": "0x6030",
								"subindex": "0x01",
								"size": 1
							},

							{
								"index": "0x6030",
								"subindex": "0x02",
								"size": 1
							},

							{
								"index": "0x6030",
								"subindex": "0x03",
								"size": 2
							},

							{
								"index": "0x6030",
								"subindex": "0x05",
								"size": 2
							},

							{
								"index": "0x6030",
								"subindex": "0x07",
								"size": 1
							},

							{
								"index": "0x0000",
								"subindex": "0x00",
								"size": 1
							},

							{
								"index": "0x0000",
								"subindex": "0x00",
								"size": 5
							},

							{
								"index": "0x6030",
								"subindex": "0x0e",
								"size": 1
							},

							{
								"index": "0x6030",
								"subindex": "0x0f",
								"size": 1
							},

							{
								"index": "0x6030",
								"subindex": "0x10",
								"size": 1
							},

							{
								"index": "0x6030",
								"subindex": "0x11",
								"size": 16,

								"add_to_domain": true,
								"signed": false
							}
						]
					}
				]
			}
		]
	},

	{
		"alias": 0,
		"position": 4,
		"vendor_id": "0x00000002",
		"product_code": "0x0c663052",

		"syncs": [
			{
				"index": 3,
				"watchdog_enabled": false,
				"pdos": [
					{
						"index": "0x1a00",
						"entries": [
							{
								"index": "0x6000",
								"subindex": "0x01",
								"size": 1
							},

							{
								"index": "0x6000",
								"subindex": "0x02",
								"size": 1
							},

							{
								"index": "0x6000",
								"subindex": "0x03",
								"size": 2